{
  "schemaVersion": "2.0.0",
  "planId": "PLAN-2026-09-05-PSO-125",
  "generatedAt": "2026-09-05T17:10:00.000Z",
  "sourceReview": "reports/code-audit-review.json",
  "prioritization": ["prerequisite", "containment", "security-severity", "exploitability", "user-impact", "confidence", "complexity", "remediation-cost"],
  "milestones": [
    {"id": "P4-release-assurance", "title": "Complete release-grade external evidence", "itemIds": ["REM-0205"]}
  ],
  "items": [
    {
      "id": "REM-0205", "title": "Complete current release assurance evidence", "findingIds": ["AUD-0205"], "securitySeverity": "medium", "priority": 1,
      "complexity": "very-high", "complexityRationale": "Requires a second qualified reviewer, signing key custody, independent signed review, distribution monitoring, and final production verification.",
      "ownerRole": "Release owner", "dependsOn": [], "scope": "release evidence, hosted CI, signing, SBOM, provenance, independent review, and release verification",
      "implementationSteps": ["Add a distinct qualified collaborator or team and require at least one approving review for main.", "Provision a controlled release-signing identity and externally trusted public-key fingerprint.", "Establish distribution monitoring, failure ownership, and artifact revocation signals.", "Obtain a distinct independently signed review bound to the exact candidate.", "Sign the candidate checksum manifest and run production verification.", "Clear blockers only after all evidence validates."],
      "acceptanceCriteria": ["Current-revision matrix, CodeQL, and hosted secret/dependency controls pass.", "SBOM, provenance, and trusted signature verify.", "A distinct independent review binds the exact candidate.", "Distribution monitoring and revocation ownership are recorded.", "Production release verification has no blockers."],
      "verification": ["Run npm run check.", "Run production release verification.", "Independently verify evidence digests."],
      "rollout": "Clear evidence blockers independently; publish only after all are complete.", "rollback": "Reinstate blockers and revoke affected artifacts if evidence becomes invalid.",
      "requiresApproval": true, "approvalReason": "Requires external CI, signing key custody, independent review, and possible publication.", "residualRisk": "Release assurance expires as code, dependencies, platforms, and keys change.", "parallelGroup": null
    }
  ],
  "dispositions": [],
  "limitations": [
    "AUD-0201, AUD-0202, AUD-0203, AUD-0204, AUD-0206, and AUD-0207 were closed by re-audit and are not scheduled again.",
    "This plan does not execute remediation.",
    "External and destructive actions remain separately approval-gated.",
    "P3 specialist assurance and P4 source, candidate-integrity, hosted CI, CodeQL, and repository-hardening work are complete.",
    "P1 and P2-execution-safety records predate immutable snapshots and remain historical evidence; new executions use schema 3.0 snapshots.",
    "Source assurance remains insufficient-evidence."
  ]
}